{
 "note": "Every internal identifier this project uses, parsed from the registries that define them. An identifier in user-facing text is a build failure (HANDOFF.md rule 3). Public replacements are in DECISIONS.md D-05. This file is generated; editing it by hand puts it one commit behind the next identifier.",
 "counts": {
  "total": 399,
  "byFamily": {
   "campaign card": 27,
   "errata": 61,
   "experiment": 10,
   "hypothesis": 66,
   "instrument": 95,
   "kill criterion": 25,
   "prediction": 18,
   "project codename": 6,
   "science": 36,
   "theorem": 14,
   "work package": 47
  }
 },
 "families": {
  "campaign card": [
   "ADJ-AVP",
   "ATLAS-VCE",
   "CAL-TRANSFER",
   "CAPACITY-WELCH",
   "CHI-DRIFT",
   "CONF-PARTIAL",
   "DECOMP",
   "EMB-LORA",
   "ERR-RB2",
   "EVAL-AWARE",
   "FACT-KUI",
   "FIELD-FLAT",
   "FORECAST-CAT",
   "FORENSIC-RECEIPT",
   "GAUGE-E19",
   "GAUGE-XFAM",
   "HACK-FORE",
   "HUMP",
   "JUDGE-VBC",
   "LADDER",
   "META-LEDGER",
   "PPE-BON",
   "STYLE-RMB",
   "SURGERY",
   "TOPO-HODGE",
   "VALUES-CONTEST",
   "VERIF-PRM"
  ],
  "errata": [
   "E1",
   "E10",
   "E11",
   "E12",
   "E13",
   "E14",
   "E15",
   "E16",
   "E17",
   "E18",
   "E19",
   "E2",
   "E20",
   "E21",
   "E22",
   "E23",
   "E24",
   "E25",
   "E26",
   "E27",
   "E28",
   "E29",
   "E3",
   "E30",
   "E31",
   "E32",
   "E33",
   "E34",
   "E35",
   "E36",
   "E37",
   "E38",
   "E39",
   "E4",
   "E40",
   "E41",
   "E42",
   "E43",
   "E44",
   "E45",
   "E46",
   "E47",
   "E48",
   "E49",
   "E5",
   "E50",
   "E51",
   "E52",
   "E53",
   "E54",
   "E55",
   "E56",
   "E57",
   "E58",
   "E59",
   "E6",
   "E60",
   "E61",
   "E7",
   "E8",
   "E9"
  ],
  "experiment": [
   "X1",
   "X10",
   "X2",
   "X3",
   "X4",
   "X5",
   "X6",
   "X7",
   "X8",
   "X9"
  ],
  "hypothesis": [
   "H-avp",
   "H-aware",
   "H-aware-organic-fpr",
   "H-aware-probe",
   "H-aware-steer",
   "H-bias",
   "H-bias-first",
   "H-brier",
   "H-canon",
   "H-capacity",
   "H-capacity-perm",
   "H-chi",
   "H-chi-beats-var",
   "H-chi-bon",
   "H-contest",
   "H-contest-vs-ensemble",
   "H-coverage",
   "H-credulity",
   "H-dark",
   "H-dark-kdeff",
   "H-erase",
   "H-err",
   "H-err-llama",
   "H-err-qwen",
   "H-flag",
   "H-flat",
   "H-forecast",
   "H-forecast-beats-size",
   "H-forecast-mae",
   "H-hump",
   "H-hump-exists",
   "H-hump-loc",
   "H-intransitive",
   "H-kui",
   "H-kui-control",
   "H-kui-gap",
   "H-kui-perm",
   "H-ladder",
   "H-ladder-beats-flat",
   "H-ladder-coverage",
   "H-localize",
   "H-lowerquantile",
   "H-partial",
   "H-partial-lineage",
   "H-partial-perm",
   "H-raw",
   "H-reliance",
   "H-retain",
   "H-stabilize",
   "H-style",
   "H-style-baseline",
   "H-style-perm",
   "H-style-transfer",
   "H-tacit",
   "H-tail",
   "H-tail-plateau",
   "H-transfer",
   "H-vbc",
   "H-vce",
   "H-vce-p",
   "H-verif",
   "H-verif-loc",
   "H-verif-style",
   "H-welch",
   "H-xfam",
   "H-xfam-perm"
  ],
  "instrument": [
   "A1",
   "A2",
   "A3",
   "A4",
   "A5",
   "A6",
   "A7",
   "B1",
   "B2",
   "B3",
   "B4",
   "B5",
   "B6",
   "C1",
   "C2",
   "C3",
   "C4",
   "C5",
   "C6",
   "C7",
   "C8",
   "C9",
   "D1",
   "D10",
   "D2",
   "D3",
   "D4",
   "D5",
   "D6",
   "D7",
   "D8",
   "D9",
   "E1",
   "E2",
   "E3",
   "E4",
   "E5",
   "E6",
   "F1",
   "F2",
   "F3",
   "F4",
   "F5",
   "F6",
   "G1",
   "G2",
   "G3",
   "G4",
   "G5",
   "H1",
   "H2",
   "H3",
   "H4",
   "H5",
   "I1",
   "I2",
   "I3",
   "I4",
   "I5",
   "I6",
   "I7",
   "J1",
   "J2",
   "J3",
   "J4",
   "J5",
   "J6",
   "K1",
   "K2",
   "K3",
   "K4",
   "L1",
   "L2",
   "L3",
   "L4",
   "L5",
   "M1",
   "M10",
   "M11",
   "M2",
   "M3",
   "M4",
   "M5",
   "M6",
   "M7",
   "M8",
   "M9",
   "N1",
   "N2",
   "N3",
   "N4",
   "N5",
   "N6",
   "N7",
   "N8"
  ],
  "kill criterion": [
   "K-avp",
   "K-aware",
   "K-chi",
   "K-contest",
   "K-emb",
   "K-err",
   "K-forecast",
   "K-forensic",
   "K-gauge",
   "K-hackfore",
   "K-hump",
   "K-kui",
   "K-ladder",
   "K-meta",
   "K-partial",
   "K-ppe",
   "K-style",
   "K-surgery",
   "K-topo",
   "K-transfer",
   "K-vbc",
   "K-vce",
   "K-verif",
   "K-welch",
   "K-xfam"
  ],
  "prediction": [
   "P1",
   "P10",
   "P11",
   "P12",
   "P13",
   "P14",
   "P2",
   "P3",
   "P4",
   "P5",
   "P6",
   "P7",
   "P8",
   "P9",
   "R1",
   "R2",
   "R3",
   "R4"
  ],
  "project codename": [
   "ASSAY",
   "BUILD_STATE",
   "CALIPER",
   "SCOREBOARD",
   "SPEC-ERRATA",
   "WORKS_LEDGER"
  ],
  "science": [
   "S02",
   "S03",
   "S05",
   "S06",
   "S07",
   "S08",
   "S09",
   "S10",
   "S11",
   "S12",
   "S13",
   "S14",
   "S15",
   "S16",
   "S2",
   "S3",
   "S4",
   "S5",
   "S6",
   "S7",
   "S8",
   "S9",
   "s02_gauge",
   "s03_thermo",
   "s05_capacity",
   "s06_topology",
   "s07_embryology",
   "s08_factorization",
   "s09_verification",
   "s10_decompiling",
   "s11_values",
   "s12_hackability",
   "s13_coupling",
   "s14_phase",
   "s15_forensics",
   "s16_robustness"
  ],
  "theorem": [
   "T1",
   "T10",
   "T11",
   "T12",
   "T13",
   "T14",
   "T2",
   "T3",
   "T4",
   "T5",
   "T6",
   "T7",
   "T8",
   "T9"
  ],
  "work package": [
   "W0.1",
   "W0.2",
   "W0.3",
   "W0.4",
   "W0.5",
   "W0.6",
   "W0.7",
   "W1.1",
   "W1.2",
   "W1.3",
   "W1.4",
   "W1.5",
   "W1.6",
   "W2.1",
   "W2.2",
   "W2.3",
   "W2.4",
   "W2.5",
   "W2.6",
   "W2.7",
   "W3.1",
   "W3.5",
   "W3.6",
   "W3.8",
   "W3.9",
   "W4.1",
   "W4.2",
   "W4.3",
   "W4.4",
   "W4.5",
   "W4.6",
   "W4.7",
   "W4.8",
   "W5.1",
   "W5.2",
   "W5.3",
   "W5.4",
   "W5.5",
   "W5.6",
   "W6.1",
   "W6.2",
   "W6.3",
   "W6.4",
   "W6.5",
   "W6.6",
   "W6.7",
   "W6.8"
  ]
 },
 "terms": [
  "A1",
  "A2",
  "A3",
  "A4",
  "A5",
  "A6",
  "A7",
  "ADJ-AVP",
  "ASSAY",
  "ATLAS-VCE",
  "B1",
  "B2",
  "B3",
  "B4",
  "B5",
  "B6",
  "BUILD_STATE",
  "C1",
  "C2",
  "C3",
  "C4",
  "C5",
  "C6",
  "C7",
  "C8",
  "C9",
  "CAL-TRANSFER",
  "CALIPER",
  "CAPACITY-WELCH",
  "CHI-DRIFT",
  "CONF-PARTIAL",
  "D1",
  "D10",
  "D2",
  "D3",
  "D4",
  "D5",
  "D6",
  "D7",
  "D8",
  "D9",
  "DECOMP",
  "E1",
  "E10",
  "E11",
  "E12",
  "E13",
  "E14",
  "E15",
  "E16",
  "E17",
  "E18",
  "E19",
  "E2",
  "E20",
  "E21",
  "E22",
  "E23",
  "E24",
  "E25",
  "E26",
  "E27",
  "E28",
  "E29",
  "E3",
  "E30",
  "E31",
  "E32",
  "E33",
  "E34",
  "E35",
  "E36",
  "E37",
  "E38",
  "E39",
  "E4",
  "E40",
  "E41",
  "E42",
  "E43",
  "E44",
  "E45",
  "E46",
  "E47",
  "E48",
  "E49",
  "E5",
  "E50",
  "E51",
  "E52",
  "E53",
  "E54",
  "E55",
  "E56",
  "E57",
  "E58",
  "E59",
  "E6",
  "E60",
  "E61",
  "E7",
  "E8",
  "E9",
  "EMB-LORA",
  "ERR-RB2",
  "EVAL-AWARE",
  "F1",
  "F2",
  "F3",
  "F4",
  "F5",
  "F6",
  "FACT-KUI",
  "FIELD-FLAT",
  "FORECAST-CAT",
  "FORENSIC-RECEIPT",
  "G1",
  "G2",
  "G3",
  "G4",
  "G5",
  "GAUGE-E19",
  "GAUGE-XFAM",
  "H-avp",
  "H-aware",
  "H-aware-organic-fpr",
  "H-aware-probe",
  "H-aware-steer",
  "H-bias",
  "H-bias-first",
  "H-brier",
  "H-canon",
  "H-capacity",
  "H-capacity-perm",
  "H-chi",
  "H-chi-beats-var",
  "H-chi-bon",
  "H-contest",
  "H-contest-vs-ensemble",
  "H-coverage",
  "H-credulity",
  "H-dark",
  "H-dark-kdeff",
  "H-erase",
  "H-err",
  "H-err-llama",
  "H-err-qwen",
  "H-flag",
  "H-flat",
  "H-forecast",
  "H-forecast-beats-size",
  "H-forecast-mae",
  "H-hump",
  "H-hump-exists",
  "H-hump-loc",
  "H-intransitive",
  "H-kui",
  "H-kui-control",
  "H-kui-gap",
  "H-kui-perm",
  "H-ladder",
  "H-ladder-beats-flat",
  "H-ladder-coverage",
  "H-localize",
  "H-lowerquantile",
  "H-partial",
  "H-partial-lineage",
  "H-partial-perm",
  "H-raw",
  "H-reliance",
  "H-retain",
  "H-stabilize",
  "H-style",
  "H-style-baseline",
  "H-style-perm",
  "H-style-transfer",
  "H-tacit",
  "H-tail",
  "H-tail-plateau",
  "H-transfer",
  "H-vbc",
  "H-vce",
  "H-vce-p",
  "H-verif",
  "H-verif-loc",
  "H-verif-style",
  "H-welch",
  "H-xfam",
  "H-xfam-perm",
  "H1",
  "H2",
  "H3",
  "H4",
  "H5",
  "HACK-FORE",
  "HUMP",
  "I1",
  "I2",
  "I3",
  "I4",
  "I5",
  "I6",
  "I7",
  "J1",
  "J2",
  "J3",
  "J4",
  "J5",
  "J6",
  "JUDGE-VBC",
  "K-avp",
  "K-aware",
  "K-chi",
  "K-contest",
  "K-emb",
  "K-err",
  "K-forecast",
  "K-forensic",
  "K-gauge",
  "K-hackfore",
  "K-hump",
  "K-kui",
  "K-ladder",
  "K-meta",
  "K-partial",
  "K-ppe",
  "K-style",
  "K-surgery",
  "K-topo",
  "K-transfer",
  "K-vbc",
  "K-vce",
  "K-verif",
  "K-welch",
  "K-xfam",
  "K1",
  "K2",
  "K3",
  "K4",
  "L1",
  "L2",
  "L3",
  "L4",
  "L5",
  "LADDER",
  "M1",
  "M10",
  "M11",
  "M2",
  "M3",
  "M4",
  "M5",
  "M6",
  "M7",
  "M8",
  "M9",
  "META-LEDGER",
  "N1",
  "N2",
  "N3",
  "N4",
  "N5",
  "N6",
  "N7",
  "N8",
  "P1",
  "P10",
  "P11",
  "P12",
  "P13",
  "P14",
  "P2",
  "P3",
  "P4",
  "P5",
  "P6",
  "P7",
  "P8",
  "P9",
  "PPE-BON",
  "R1",
  "R2",
  "R3",
  "R4",
  "S02",
  "S03",
  "S05",
  "S06",
  "S07",
  "S08",
  "S09",
  "S10",
  "S11",
  "S12",
  "S13",
  "S14",
  "S15",
  "S16",
  "S2",
  "S3",
  "S4",
  "S5",
  "S6",
  "S7",
  "S8",
  "S9",
  "SCOREBOARD",
  "SPEC-ERRATA",
  "STYLE-RMB",
  "SURGERY",
  "T1",
  "T10",
  "T11",
  "T12",
  "T13",
  "T14",
  "T2",
  "T3",
  "T4",
  "T5",
  "T6",
  "T7",
  "T8",
  "T9",
  "TOPO-HODGE",
  "VALUES-CONTEST",
  "VERIF-PRM",
  "W0.1",
  "W0.2",
  "W0.3",
  "W0.4",
  "W0.5",
  "W0.6",
  "W0.7",
  "W1.1",
  "W1.2",
  "W1.3",
  "W1.4",
  "W1.5",
  "W1.6",
  "W2.1",
  "W2.2",
  "W2.3",
  "W2.4",
  "W2.5",
  "W2.6",
  "W2.7",
  "W3.1",
  "W3.5",
  "W3.6",
  "W3.8",
  "W3.9",
  "W4.1",
  "W4.2",
  "W4.3",
  "W4.4",
  "W4.5",
  "W4.6",
  "W4.7",
  "W4.8",
  "W5.1",
  "W5.2",
  "W5.3",
  "W5.4",
  "W5.5",
  "W5.6",
  "W6.1",
  "W6.2",
  "W6.3",
  "W6.4",
  "W6.5",
  "W6.6",
  "W6.7",
  "W6.8",
  "WORKS_LEDGER",
  "X1",
  "X10",
  "X2",
  "X3",
  "X4",
  "X5",
  "X6",
  "X7",
  "X8",
  "X9",
  "s02_gauge",
  "s03_thermo",
  "s05_capacity",